Date,Title,URL
03/11/2022,"´Gallina vieja hace buen caldo´, Bilbao celebra 38 años de locura",https://www.diariopresente.mx/espectaculos/respaldan-38-anos-de-profesionalismo-a-bilbao/359719
03/11/2022,Belinda rompe el silencio y envía poderoso mensaje a mujeres que vivieron violencia como ella,https://www.diariopresente.mx/espectaculos/belinda-demuestra-apoyo-a-mujeres-maltratadas/359701
03/11/2022,"""Karely Ruiz destruyó mi matrimonio"": mujer aseguró que terminó su relación de 20 años por la influencer",https://www.diariopresente.mx/espectaculos/mujer-culpa-a-karely-ruiz-de-ser-el-motivo-de-su-divorcio/359674
02/11/2022,"YosStop habla de lo difícil de la lactancia; ""mis ´chichis´ a su disposición""",https://www.diariopresente.mx/espectaculos/influencer-yosstop-sufre-ansiedad-por--la-lactancia/359593
02/11/2022,¿Será Rubí o La Usurpadora? Belinda quiere regresar a las telenovelas con un remake,https://www.diariopresente.mx/espectaculos/belinda-regresara-al-mundo-de-las-novelas-tal-vez-como-rubi/359588
02/11/2022,Alfredo Adame se hace limpia para evitar más peleas,https://www.diariopresente.mx/espectaculos/el-conductor-fue-protegido-contra-las-envidias/359592
02/11/2022,Cuquita rompe el silencio y habla de las infidelidades de Vicente Fernández,https://www.diariopresente.mx/espectaculos/dona-cuquita-recuerda-infidelidades-de-vicente-fernandez/359554
01/11/2022,¡Como Tigre de Santa Julia! Captan a Maluma en el baño y esta fue su reacción,https://www.diariopresente.mx/espectaculos/captan-a-maluma-en-el-trono-y-se-vuelve-tendencia/359471
01/11/2022,Carlos Vives modifica letra de La Bicicleta para apoyar a Shakira en su separación de Piqué,https://www.diariopresente.mx/espectaculos/carlos-vives-modifica-cancion-para-que-shakira-supere-a-ex/359461
01/11/2022,¿Quién es el novio de Karely Ruiz? Reguetonero sería nuevo amor,https://www.diariopresente.mx/espectaculos/karely-ruiz-tiene-novio-reguetonero/359450
01/11/2022,Fanáticos de Kanye West recaudan dinero para que recupere su fortuna,https://www.diariopresente.mx/espectaculos/fans-organizan-recaudacion-de-dinero/359446
01/11/2022,Confirman secuela de Malcolm el de en medio,https://www.diariopresente.mx/espectaculos/malcolm-el-de-en-medio-tendra-secuela/359396
01/11/2022,"Ex novia de Nodal fue invitada al Beliween, la fiesta de Halloween de Belinda",https://www.diariopresente.mx/espectaculos/ex-novias-de-nodal-en-fiesta-de-halloween/359378
31/10/2022,Nerea Godínez visitó Paraíso y así recordó a Octavio Ocaña,https://www.diariopresente.mx/espectaculos/nerea-godinez-recuerda-a-octavio-ocana-en-paraiso/359267
30/10/2022,Belinda tatúa a fan en concierto y lanza indirecta a exnovios; aunque te lo borres ahí va a estar,https://www.diariopresente.mx/espectaculos/belinda-tira-indirecta-a-sus-exs-que-se-tatuaron-su-nombre/359172
30/10/2022,"¡Ya es mamá! YosStop comparte primera imagen de Amy, su hija",https://www.diariopresente.mx/espectaculos/yosstop-nos-regala-las-primeras-imagenes-con-su-hija/359171
30/10/2022,Conmemoran tradición de Día de Muertos en el Centro Histórico,https://www.diariopresente.mx/espectaculos/en-el-centro-historico-conmemoran-a-los-muertos/359163
30/10/2022,Reyli sorprende en Festival de la Butifarra,https://www.diariopresente.mx/espectaculos/en-el-festival-de-la-butifarra-reyli-hace-acto-de-presencia/359158
30/10/2022,Franco Escamilla celebra 15 años de casado en el restaurante donde era mesero,https://www.diariopresente.mx/espectaculos/franco-escamilla-preparo-aniversario-de-casados-a-su-esposa/359122
29/10/2022,Actores de Vecinos recuerdan a Octavio Ocaña a un año de su muerte,https://www.diariopresente.mx/espectaculos/amigos-de-octavio-ocana-recuerdan-al-actor/359090
29/10/2022,"Conoce la historia detrás de La Mushasha Shula, canción viral de Espinoza Paz",https://www.diariopresente.mx/espectaculos/esta-es-la-historia-de--la-mushasha-shula/359042
29/10/2022,Así reaccionó la hija de Canelo al incomodado video de baile con su padre,https://www.diariopresente.mx/espectaculos/hija-del-canelo-reacciona-a-video-polemico-con-su-padre/359029
28/10/2022,Juan Gabriel estrena Déjame Vivir junto a Anahí,https://www.diariopresente.mx/espectaculos/juan-gabriel-deja-un-ultimo-sencillo-dejame-vivir/358999
28/10/2022,Daddy Yankee ofrece espectáculo de drones en concierto de Cancún,https://www.diariopresente.mx/espectaculos/daddy-yankee-viste-de-drones-su-concierto-en-cancun/358998
28/10/2022,"Taylor Swift elimina la palabra ""gorda"" de un video musical tras críticas",https://www.diariopresente.mx/espectaculos/taylor-swift-borra-la-palabra-gorda-de-un-video/358976
28/10/2022,"¡Órale, cuates! Chabelo regresa a la televisión con dos importantes proyectos",https://www.diariopresente.mx/espectaculos/chabelo-regresa-como-serie-y-caricatura/358879
27/10/2022,La película más conmovedora y poderosa de Marvel; crítica se rinde ante Wakanda Forever,https://www.diariopresente.mx/espectaculos/wakanda-forever-tiene-la-mejor-critica-y-hace-honor-a-marvel/358885
27/10/2022,"Acusan a Taylor Swift de gordofobia por video ´Anti-hero´; ""ser gorda es su pesadilla""",https://www.diariopresente.mx/espectaculos/taylor-swift-criticada-por-sufrir-gordofobia/358873
27/10/2022,Gemelas Ocaña cumplen años teniendo en su corazón a Octavio,https://www.diariopresente.mx/espectaculos/gemelas-ocana-festejan-cumpleanos-numero-29/358896
27/10/2022,Gracias por ser tan especial; revelan carta de amor que Ricky Martin mandó a Eduardo Verástegui,https://www.diariopresente.mx/espectaculos/ricky-martin-y-su-carta-de-amor-para-eduardo-verastegui/358854
27/10/2022,Familia de Octavio Ocaña busca a segundo policía presuntamente implicado en la muerte del actor,https://www.diariopresente.mx/espectaculos/buscan-a-segundo-policia-presuntamente-implicado/358820
26/10/2022,"En pleno concierto de Karol G una mujer dio a luz, la cantante la visitó en el hospital",https://www.diariopresente.mx/espectaculos/mujer-tiene-a-su-bebe-en-pleno-concierto-de-karol-g/358714
26/10/2022,Aplazan audiencia para definir sentencia final de Pablo Lyle por homicidio involuntario,https://www.diariopresente.mx/espectaculos/posponen-audiencia-de-sentencia-de-pablo-lyle/358628
25/10/2022,Al cantante Julio Preciado no le parecen ciertas actitudes en el escenario de los artistas jóvenes,https://www.diariopresente.mx/espectaculos/julio-preciado-critica-a-artistas-jovenes-musica-regional/358549
24/10/2022,Muere el cómico Leslie Jordan en un accidente de tránsito,https://www.diariopresente.mx/espectaculos/fallece-leslie-jordan/358389
24/10/2022,Talina Fernández se hace perfil de Tinder a sus 78 años,https://www.diariopresente.mx/espectaculos/a-sus-78-anos-talina-fernandez-usa-tinder/358352
23/10/2022,Tim Burton se lanza contra Disney y considera que se volvió un gran circo horrible,https://www.diariopresente.mx/espectaculos/tim-burton-critica-disney-diciendo-que-es-un-circo/358274
23/10/2022,Reportan que Clara Chía atraviesa un mal momento por relación con Piqué; no la está llevando bien,https://www.diariopresente.mx/espectaculos/le-duro-poco-el-amor-entre-clara-chia-y-pique/358272
23/10/2022,"Fallece Consuelo Angulo de Hernández, mamá de Los Tigres del Norte",https://www.diariopresente.mx/espectaculos/tigres-del-norte-de-luto/358271
13/10/2022,La influencia de Frida Kahlo e Impacto en la Educación Artística Actual,https://www.diariopresente.mx/cultura/frida-kahlo-y--su-impacto/356720
06/10/2022,Otorgan Premio Nobel de Literatura 2022 a Annie Ernaux,https://www.diariopresente.mx/cultura/annie-ernaux-gana-el-premio-nobel-de-literatura/355549
25/09/2022,Con éxito total se presentó por segunda ocasión Expediente León en Tabasco,https://www.diariopresente.mx/cultura/exponen-obra-de-teatro-ante-el-poder-judicial/353805
24/09/2022,"Atilano Caña, artista plástico presenta Exposición Cómo no Amarte, Mujer de Campo",https://www.diariopresente.mx/cultura/jonuteco-atilano-cana-presenta-exposicion-en-villahermosa/353765
12/09/2022,El descenso de la Serpiente Lunar cautiva en las ruinas de Chichén Itzá,https://www.diariopresente.mx/cultura/serpiente-lunar-cautiva-en-chichen-itza/351816
12/09/2022,Chefs mexicanos ganan concurso a la mejor paella del mundo en España,https://www.diariopresente.mx/cultura/mexicanos-ganan-premio-al-cocinar-la-mejor-paella-del-mundo/351720
11/09/2022,Fallece de neumonía el escritor español Javier Marías,https://www.diariopresente.mx/cultura/fallecio-el-escritor-de-el-hombre-sentimental/351623
31/08/2022,Anuncian apertura del Planetario Tabasco 2000,https://www.diariopresente.mx/cultura/reinauguran-el-planetario-con-funciones-gratuitas/349850
25/08/2022,Museos para revivir la historia de la Independencia de México,https://www.diariopresente.mx/cultura/conoce-los-famosos-museos-sobre-la-independencia-de-mexico/349050
25/08/2022,Las galerías de arte más originales del mundo,https://www.diariopresente.mx/cultura/el-arte-mas-originales-del-mundo/349262
24/08/2022,Las galerías de arte más originales del mundo,https://www.diariopresente.mx/cultura/impresionantes-galerias-mas-originales-en-el-mundo/348947
23/08/2022,Llega exposición de abanicos a Oxolotán,https://www.diariopresente.mx/cultura/inicia-exposicion-de-abanicos-en-tacotalpa/348590
18/08/2022,El creador artístico Marco Tulio Lamoyi cumple un año más de vida,https://www.diariopresente.mx/cultura/un-ano-mas-de-vida-celebra-marco-tulio-lamoyi/347797
17/08/2022,Conoce el libro infantil que busca preservar las lenguas indígenas y la cultura mexicana,https://www.diariopresente.mx/cultura/ra-cuala-libro-que-preserva-lenguas-indigenas-en-mexico/347669
16/08/2022,Los Óscar se disculpan 50 años después con la indígena que recogió el premio de Marlon Brando,https://www.diariopresente.mx/cultura/la-academia-los-oscar-se-disculpo-con-la-indigena-sacheen/347498
15/08/2022,Recuperan 93 piezas arqueológicas en un tianguis de la CDMX,https://www.diariopresente.mx/cultura/incautan-93-piezas-arqueologicas-en-mercado-de-mexico/347332
15/08/2022,Primera Universidad de las Lenguas Indígenas en México abrirá en 2023,https://www.diariopresente.mx/cultura/abriran-universidad-para-lenguas-indigenas-en-mexico/347323
15/08/2022,Programación especial para celebrar el Día Nacional del Cine Mexicano,https://www.diariopresente.mx/cultura/dia-del-cine-mexicano-mira-la-programacion-especial/347279
15/08/2022,Huamantla pueblo mágico rompe récord Guinness por el tapete de aserrín más largo del mundo,https://www.diariopresente.mx/cultura/el-pueblo-magico-huamantla-tlaxcala-rompe-record-guinness/347262
14/08/2022,lndígenas chontales con danzas ancestrales iniciaron fiesta patronal a la Asunción,https://www.diariopresente.mx/cultura/iniciaron-fiesta-patronal-de-la-virgen-de-la-asuncion-de-maria/347086
11/08/2022,México busca reunirse con Francia para tratar el tráfico de piezas culturales,https://www.diariopresente.mx/cultura/mexico-tratara-dialogo-con-francia-por-trafico-de-piezas/346683
11/08/2022,EU entrega a México escultura virreinal robada de una parroquia en Morelos hace 20 años,https://www.diariopresente.mx/cultura/mexico-recupera-escultura-robada-hace-20-anos-de-jiutepec/346667
08/08/2022,Realizan emotiva ceremonia de bautizo a la pequeña Emma Sophía,https://www.diariopresente.mx/sociales/celebran-con-hermosa-ceremonia-de-bautizo-a-emma-sophia/346077
04/11/2022,Joven deposita 20 mil pesos a cuenta equivocada; se niegan a devolverlos,https://www.diariopresente.mx/actualidad/por-error-joven-deposita-20-mil-pesos-a-cuenta-equivocada/359815
04/11/2022,´El ángel de la muerte´: la historia real del enfermero asesino Charles Cullen,https://www.diariopresente.mx/actualidad/esta-es-la-historia-real-del-angel-de-la-muerte/359800
04/11/2022,Twitter hará recorte de personal este viernes; Comenzaremos el difícil proceso,https://www.diariopresente.mx/actualidad/twitter-despedira-mas-del-50-por-ciento-de-sus-empleados/359738
03/11/2022,Chofer de autobús ´se duerme´ y choca; esto hicieron los pasajeros ,https://www.diariopresente.mx/actualidad/chofer-causa-accidente-al-parecer-se-desmayo/359718
03/11/2022,Alumnas exhiben a compañera por no hacer trabajo en equipo; le toman foto en estética,https://www.diariopresente.mx/actualidad/alumnas-son-tendencia-al-exhibir-a-su-companera-floja/359702
03/11/2022,Niño se disfraza de tamal oaxaqueño y gana concurso de Halloween,https://www.diariopresente.mx/actualidad/nino-se-disfraza-de-tamal-oaxaqueno/359695
03/11/2022,"Crisis medioambiental: Los humanos, cada vez más solos en la Tierra",https://www.diariopresente.mx/actualidad/situacion-medioambiental-es-preocupante/359681
03/11/2022,¿Cómo participar en el sorteo del SAT por el buen fin 2022?,https://www.diariopresente.mx/actualidad/el-sat-organiza-un-sorteo-para-el-buen-fin/359678
03/11/2022,Mujer acusa a Karely Ruiz de destruir su matrimonio; le encontró fotos a su esposo,https://www.diariopresente.mx/actualidad/mujer-dice-que-karely-ruiz-destruyo-su-matrimonio/359605
02/11/2022,Mujer entra a salón de clases y golpea a alumno; lo acusa de agredir a su hijo,https://www.diariopresente.mx/actualidad/mama-golpea-al-agresor-de-su-hijo-y-la-acusan-de-agresion/359595
02/11/2022,Niño se disfraza de personaje de la icónica película El Libro de Piedra y rompe las redes,https://www.diariopresente.mx/actualidad/nino-se-disfraza-de-iconica-pelicula-mexicana-de-los-60/359591
02/11/2022,Las 3 mejores estrategias para jugar en una ruleta online,https://www.diariopresente.mx/actualidad/ruleta-online-disponibles-para-jugar-en-linea/359539
02/11/2022,La NASA capta insólita sonrisa del Sol que podría afectar a la Tierra,https://www.diariopresente.mx/actualidad/sonrisa-del-sol-afectara-a-la-tierra/359498
02/11/2022,"¿Cempasúchil china o mexicana?, así puedes diferenciar el tipo de flor que compraste",https://www.diariopresente.mx/actualidad/diferencias-entre-la-flor-de-cempasuchil-china-y-mexicana/359531
02/11/2022,¡Hasta el piso! Mujeres pelean con todo en boda por quedarse con ramo de la novia,https://www.diariopresente.mx/actualidad/batalla-campal-por-el-ramo-de-la-novia-termina-en-el-piso/359473
01/11/2022,"¡Ay, nanita! Joven capta aterrador lamento de La Llorona; aquí el video",https://www.diariopresente.mx/actualidad/captan-lamentos-de-la-llorona-y-se-vulve-viral/359470
01/11/2022,Vine llegaría a Twitter a finales de este año; aún necesita mucho trabajo,https://www.diariopresente.mx/actualidad/vine-tendra-un-regreso-a-travez-de-twitter/359462
01/11/2022,Joven disfraza a su abuelita de Mamá Coco y ganan concurso de disfraces en un antro,https://www.diariopresente.mx/actualidad/joven-disfraza-a-su-abuelita-de-mama-coco/359447
01/11/2022,Perritos se pelean en escuela y estropean ofrenda del Día de Muertos,https://www.diariopresente.mx/actualidad/perros-pelean-encima-de-una-ofrenda/359437
01/11/2022,Cómo planificar las mejores vacaciones en Playa del Carmen,https://www.diariopresente.mx/actualidad/playa-del-carmen-una-maravilla-para-los-nadadores/359443
01/11/2022,Abuelito lleva lonche todos los días a su nieta; tierno gesto se vuelve viral,https://www.diariopresente.mx/actualidad/abuelito-lleva-lonche-todos-los-dias-a-su-nieta/359426
01/11/2022,¡Alerta! 5 cosas que por ninguna razón debes comprar de segunda mano,https://www.diariopresente.mx/actualidad/productos-que-no-debes-comprar-de-segunda-mano/359400
01/11/2022,"Novio termina enfurecido por reto, presta a su novia para un beso a cambio de 5 mil pesos",https://www.diariopresente.mx/actualidad/novio-termina-a-su-novia-por-reto-de-besar-a-desconocido/359388
31/10/2022,Elon Musk planea cobrar 20 dólares al mes por verificar cuentas en Twitter,https://www.diariopresente.mx/actualidad/el-nuevo-dueno-de-twitter-planea-cobrar-para-verificacion/359333
31/10/2022,Sacerdote abandona a novios en plena misa porque estaban grabando ,https://www.diariopresente.mx/actualidad/sacerdote-no-realiza-misa-de-matrimonio-por-grabar/359303
31/10/2022,¿Tienes monedas antiguas? Banxico te dice cual es su valor actual,https://www.diariopresente.mx/actualidad/banxico-revela-el-valor-de-monedas-antiguas/359247
31/10/2022,Indigna disfraz de Halloween de Selena con balazo en el cuerpo,https://www.diariopresente.mx/actualidad/indignacion-por-disfraz-de-selena-quintanilla-con-balazo/359185
30/10/2022,¡Bien vivaracho! Perrito se come ofrenda de Día de Muertos y su dueña lo cacha,https://www.diariopresente.mx/actualidad/perrito-se-vuelve-viral-por-comerse-lo-del-altar/359182
30/10/2022,Con la camisa bien puesta: Empleados de Coppel ofrecen crédito en medio de inundación,https://www.diariopresente.mx/actualidad/empleados-de-coppel-demuestran-que-ni-el-agua-los-detiene/359170
30/10/2022,En San Luis Potosí crean pulque curado de cempasúchil para recordar a los que ya se fueron,https://www.diariopresente.mx/actualidad/en-san-luis-potosi-preparan-pulque-de-cempasuchil/359131
29/10/2022,Maestra pide papel picado para altar de muertos y esto es lo que llevó una alumna colombiana,https://www.diariopresente.mx/actualidad/maestra-pide-papel-picado-para-altar/359107
29/10/2022,Joven sufre estrepitosa caída por ir distraído con su celular,https://www.diariopresente.mx/actualidad/joven-cae-en-agujero-por-caminar-distraido-con-su-celular/359092
29/10/2022,¡Lomitos al ataque! Perritos devoran ofrendas de Día de Muertos,https://www.diariopresente.mx/actualidad/en-redes-sociales-se-viralizaron-las-ofrendas-de-mascotas/359086
29/10/2022,¿Problemas con Buró de Crédito?; esta deuda manchará tu historial por 6 años,https://www.diariopresente.mx/actualidad/deudas-que-manchan-tu-historial-de-buro-de-credito/359027
28/10/2022,"Así fue la trágica muerte de San Judas Tadeo, el santo de las causas difíciles",https://www.diariopresente.mx/actualidad/todo-sobre-la-tragica-historia-de-san-judas-tadeo/358994
28/10/2022,¿Cuánto dinero recibirán los ejecutivos de Twitter que fueron despedidos por Elon Musk?,https://www.diariopresente.mx/actualidad/elon-musk-despidio-a-ejecutivos-al-comprar-twitter/358981
28/10/2022,Activista pega su cabeza en cuadro de La joven de la perla: el planeta se destruye,https://www.diariopresente.mx/actualidad/activista-se-manifiesta-en-cuadro-de-johannes-vermeer/358962
27/10/2022,Video: Hacen carne asada en departamento de Europa y vecinos llaman a los bomberos,https://www.diariopresente.mx/actualidad/bomberos-de-europa-llegan-apagar-incendio-y-era-un-asador/358871
27/10/2022,Decoran su casa para Halloween y policía se acerca a investigar escena que parecía real,https://www.diariopresente.mx/actualidad/la-decoracion-de-halloween-que-provoco-investigacion/358838
27/10/2022,Atención de un pediatra en centro médico,https://www.diariopresente.mx/actualidad/pediatra-y-la-importancia-de-llevar-a-tu-hijo-con-el/358844
